{
  "schema_version": 1,
  "required_task_ids": [
    "task_audit_01",
    "task_audit_02",
    "task_audit_03",
    "task_audit_04",
    "task_audit_05",
    "task_audit_06",
    "task_audit_07",
    "task_audit_08",
    "task_audit_09",
    "task_audit_10",
    "task_audit_11",
    "task_audit_12",
    "task_audit_13"
  ],
  "required_review_types": [
    "midpoint"
  ],
  "required_competencies": [
    {
      "competency_id": "comp_process_understanding",
      "definition_version": 1,
      "minimum_level": "developing",
      "minimum_evidence_strength": "supporting",
      "minimum_evidence_records": 1,
      "minimum_independent_demonstrations": 0,
      "minimum_distinct_contexts": 1
    },
    {
      "competency_id": "comp_reconciliation",
      "definition_version": 1,
      "minimum_level": "developing",
      "minimum_evidence_strength": "supporting",
      "minimum_evidence_records": 1,
      "minimum_independent_demonstrations": 0,
      "minimum_distinct_contexts": 1
    },
    {
      "competency_id": "comp_investigation",
      "definition_version": 1,
      "minimum_level": "developing",
      "minimum_evidence_strength": "supporting",
      "minimum_evidence_records": 1,
      "minimum_independent_demonstrations": 0,
      "minimum_distinct_contexts": 1
    },
    {
      "competency_id": "comp_written_communication",
      "definition_version": 1,
      "minimum_level": "developing",
      "minimum_evidence_strength": "supporting",
      "minimum_evidence_records": 1,
      "minimum_independent_demonstrations": 0,
      "minimum_distinct_contexts": 1
    }
  ],
  "capstone_task_ids": [
    "task_audit_12"
  ],
  "require_final_review": true,
  "final_review_after_capstone": true
}
